<?xml version="1.0" encoding="UTF-8"?>
<xs:schema xmlns:xs="http://www.w3.org/2001/XMLSchema">
    
    <xs:element name="inventario">
        <xs:complexType>
            <xs:sequence>
                <xs:element name="equipo" maxOccurs="unbounded">
                    <xs:complexType>
                        <xs:sequence>
                            <xs:element name="sistema_operativo" type="xs:string"/>
                            <xs:element name="ip" type="xs:string"/>
                            <xs:element name="rol" type="xs:string"/>
                            <xs:element name="estado" type="xs:string"/>
                        </xs:sequence>
                        <xs:attribute name="id" type="xs:string" use="required"/>
                        <xs:attribute name="categoria" type="xs:string" use="required"/>
                    </xs:complexType>
                </xs:element>
            </xs:sequence>
        </xs:complexType>
    </xs:element>

</xs:schema>